{"apiVersion":"delegation-resilience.org/v0alpha2","humanEvidenceRules":{"minimumIndependenceDomains":2,"requireAttestationIssuerSeparation":true,"requireParticipantIssuerSeparation":true},"keys":[{"algorithm":"Ed25519","authorizations":[{"artifactKinds":["VerificationBundle"],"maxAgeSeconds":2678400,"purpose":"verification_bundle"}],"independenceDomain":"reference-bundle-assembly","issuer":{"id":"delegation-resilience-reference","type":"organization"},"keyId":"sha256:3d6b47adf0e9d0a323007c1d7087fa23b0a0e92e2ba74ab79628543e4c9f27a6","publicKey":"pr/PpJAKy4+sRJjv0nuIE+lR+54/jHHj7eX7oV7PShQ=","status":"active","validFrom":"2026-08-01T00:00:00Z","validUntil":"2027-01-01T00:00:00Z"},{"algorithm":"Ed25519","authorizations":[{"artifactKinds":["ExerciseAttestation"],"environmentRefs":["deterministic-in-memory-simulation"],"maxAgeSeconds":2678400,"purpose":"exercise_attestation","scenarioRefs":["refund-response-loss-after-commit"]},{"artifactKinds":["ExerciseEvidence"],"environmentRefs":["deterministic-in-memory-simulation"],"maxAgeSeconds":2678400,"purpose":"exercise_evidence","scenarioRefs":["refund-response-loss-after-commit"]}],"independenceDomain":"refund-exercise-runner","issuer":{"id":"refund-game-day-runner","type":"workload"},"keyId":"sha256:ba58ae5e9f6ba89e2a3e4799758fa068c302c382e1e3e1dbf8126a80222bcd17","publicKey":"o3C6NqGXbXwm/NOGOEJurGov6e85KtsQ7kLi1MG16jI=","status":"active","validFrom":"2026-08-01T00:00:00Z","validUntil":"2027-01-01T00:00:00Z"},{"algorithm":"Ed25519","authorizations":[{"artifactKinds":["DependencySnapshot"],"maxAgeSeconds":2678400,"purpose":"dependency_snapshot"}],"independenceDomain":"refund-configuration-observer","issuer":{"id":"refund-dependency-observer","type":"workload"},"keyId":"sha256:1cf0a57978005d5b266d4f234591b6a1f543fef2a7f97ed4c2bb113ef3960fd3","publicKey":"YZDEdOaH+FFiNxHpOm3Djs7Zd6H69jR0emL8ggWz/9I=","status":"active","validFrom":"2026-08-01T00:00:00Z","validUntil":"2027-01-01T00:00:00Z"}],"kind":"TrustPolicy","metadata":{"id":"refund-portable-verification","version":"0.2.0-alpha.1"},"revokedSubjects":[],"sequenceNumber":1,"validFrom":"2026-08-01T00:00:00Z","validUntil":"2026-09-01T00:00:00Z"}